{
  "case_id": "GOLD-002",
  "skill_version": "0.1.0",
  "runtime_client": "Codex/VS Code",
  "model": "GPT-5",
  "reasoning_setting": null,
  "execution_date": "2026-07-18",
  "exact_test_input": "Compare the current release status, migration path, limitations, licensing, security, and ALM fit of Copilot Studio classic and the new agent experience.",
  "sources": [
    {
      "title": "Compare the classic and new agent experiences",
      "url": "https://learn.microsoft.com/en-us/microsoft-copilot-studio/agents-experience/classic-vs-new",
      "verified_on": "2026-07-18"
    },
    {
      "title": "What's new in Microsoft Copilot Studio",
      "url": "https://learn.microsoft.com/en-us/microsoft-copilot-studio/whats-new",
      "verified_on": "2026-07-18"
    },
    {
      "title": "Billing rates and management",
      "url": "https://learn.microsoft.com/en-us/microsoft-copilot-studio/requirements-messages-management",
      "verified_on": "2026-07-18"
    },
    {
      "title": "Configure data policies for agents",
      "url": "https://learn.microsoft.com/en-us/microsoft-copilot-studio/admin-data-loss-prevention",
      "verified_on": "2026-07-18"
    },
    {
      "title": "Establish an application lifecycle management strategy",
      "url": "https://learn.microsoft.com/en-us/microsoft-copilot-studio/guidance/alm",
      "verified_on": "2026-07-18"
    }
  ],
  "generated_output": {
    "recommendation": "Open - Use classic as the mature baseline for production-critical work. Treat the new agent experience as production-ready preview, and its new workflows as public preview, until feature, migration, licensing, security, and ALM gates are resolved for the scenario.",
    "production_recommendation": false,
    "evidence_label": "Open",
    "release_status": "UNKNOWN",
    "verified_date": "2026-07-18",
    "license_capacity": [
      "Copilot Studio licensing and Copilot Credit consumption still apply; the intended users, channel, identity, feature mix, traffic, and contract weren't supplied.",
      "No tenant capacity or entitlement was inspected."
    ],
    "geography_language": [
      "Cloud, environment region, processing path, connected services, and required languages weren't supplied."
    ],
    "limitations": [
      "The new agent experience is explicitly labelled production-ready preview, not GA.",
      "New workflows are public preview and aren't a production-critical default.",
      "Some classic features aren't available in the new experience.",
      "Microsoft documents no migration of agents between classic and new experiences."
    ],
    "security_governance": [
      "Copilot Studio data-policy enforcement can govern authentication, knowledge, connectors, HTTP, skills, channels, and triggers.",
      "Effective DLP, authentication, sharing, identity, and channel controls are tenant-specific and weren't accessed."
    ],
    "alm_implications": [
      "Maintain separate lifecycle and rollback plans because classic and new agent formats don't migrate between experiences.",
      "Use solutions, environment variables, managed promotion, and separate development/test/production environments.",
      "Plan downstream steps for non-solution-aware settings such as authentication, channels, sharing, and some telemetry settings."
    ],
    "sources": [
      {
        "title": "Compare the classic and new agent experiences",
        "url": "https://learn.microsoft.com/en-us/microsoft-copilot-studio/agents-experience/classic-vs-new",
        "authority_level": "A1",
        "source_last_updated": "2026-07-01",
        "verified_on": "2026-07-18",
        "supported_claims": [
          "The new agent experience is a production-ready preview and its new workflows are public preview.",
          "Some features are unavailable and agents can't be migrated between classic and new experiences."
        ]
      },
      {
        "title": "What's new in Microsoft Copilot Studio",
        "url": "https://learn.microsoft.com/en-us/microsoft-copilot-studio/whats-new",
        "authority_level": "A3",
        "source_last_updated": "unknown",
        "verified_on": "2026-07-18",
        "supported_claims": [
          "The first-party release record describes the June 2026 production-ready preview of the new agent experience."
        ]
      },
      {
        "title": "Billing rates and management",
        "url": "https://learn.microsoft.com/en-us/microsoft-copilot-studio/requirements-messages-management",
        "authority_level": "A1",
        "source_last_updated": "2026-07-08",
        "verified_on": "2026-07-18",
        "supported_claims": [
          "Current public Copilot Credit feature rates and included-use conditions.",
          "General prepaid-capacity enforcement occurs at 125 percent; agent-flow enforcement blocks new flow runs when prepaid capacity is exhausted."
        ]
      },
      {
        "title": "Configure data policies for agents",
        "url": "https://learn.microsoft.com/en-us/microsoft-copilot-studio/admin-data-loss-prevention",
        "authority_level": "A1",
        "source_last_updated": "2026-05-15",
        "verified_on": "2026-07-18",
        "supported_claims": [
          "Copilot Studio data-policy enforcement applies across tenants.",
          "Data policies can govern authentication, knowledge sources, connectors, HTTP, skills, channels, and event triggers."
        ]
      },
      {
        "title": "Establish an application lifecycle management strategy",
        "url": "https://learn.microsoft.com/en-us/microsoft-copilot-studio/guidance/alm",
        "authority_level": "A1",
        "source_last_updated": "2026-01-20",
        "verified_on": "2026-07-18",
        "supported_claims": [
          "Copilot Studio uses Power Platform solution-based ALM guidance.",
          "Some settings, channels, authentication, and sharing need downstream post-deployment steps."
        ]
      }
    ],
    "open_questions": [
      "Which required classic features and integrations must be reproduced in the new experience?",
      "Which current licenses, Copilot Credit plan, user identities, and capacity limits apply?",
      "Which DLP, authentication, channel, geography, and downstream ALM controls are approved?"
    ],
    "revalidation_date": "2026-08-01"
  },
  "schema_validation": {
    "schema_path": "../../../output-schema.json",
    "passed": true,
    "errors": []
  },
  "scoring": {
    "criteria": [
      {
        "name": "Current capability and release evidence",
        "passed": true,
        "notes": "Case-defined scoring dimension preserved by name during release-candidate administrative remediation.",
        "score": 100,
        "evidence": [
          "The record cites the current classic-versus-new capability page and the first-party Copilot Studio What’s new release evidence verified on 2026-07-18."
        ],
        "deviation": "None.",
        "result": "Pass"
      },
      {
        "name": "Exact status wording",
        "passed": true,
        "notes": "Case-defined scoring dimension preserved by name during release-candidate administrative remediation.",
        "score": 100,
        "evidence": [
          "The generated limitations preserve “production-ready preview” for the new agent experience and “public preview” for new workflows without normalizing either to GA."
        ],
        "deviation": "None.",
        "result": "Pass"
      },
      {
        "name": "Migration and conversion evidence",
        "passed": true,
        "notes": "Case-defined scoring dimension preserved by name during release-candidate administrative remediation.",
        "score": 100,
        "evidence": [
          "The output records that Microsoft documents no migration of agents between classic and new experiences and requires separate lifecycle and rollback plans."
        ],
        "deviation": "None.",
        "result": "Pass"
      },
      {
        "name": "Client behavior versus product status",
        "passed": true,
        "notes": "Case-defined scoring dimension preserved by name during release-candidate administrative remediation.",
        "score": 100,
        "evidence": [
          "The generated output limits product-status claims to first-party sources; the top-level deviation separately records that automatic Codex project-skill discovery was not exercised."
        ],
        "deviation": "Automatic Codex project-skill discovery was not exercised; this was recorded separately and did not alter the product-status score.",
        "result": "Pass"
      },
      {
        "name": "Material-gate abstention",
        "passed": true,
        "notes": "Case-defined scoring dimension preserved by name during release-candidate administrative remediation.",
        "score": 100,
        "evidence": [
          "The output remains Open with production_recommendation false because licensing, capacity, geography, DLP, authentication, and downstream ALM controls are unresolved."
        ],
        "deviation": "None.",
        "result": "Pass"
      }
    ],
    "score_percent": 100.0
  },
  "deviations": [
    "Automatic project-skill discovery wasn't exercised: current Codex documentation uses .agents/skills, while this lab package is under skills/. The user explicitly invoked the package and SKILL.md was loaded manually."
  ],
  "reviewer": "Codex automated evaluation; human expert review pending",
  "final_result": "Pass"
}
